60,https://www.rottentomatoes.com/m/2_fast_2_furious,2 Fast 2 Furious,"
                    This sequel focuses on ex-police officer Brian O'Conner (Paul Walker), who relocates from Los Angeles to Miami to start over. Becoming involved in the street-racing scene in his new city, Brian befriends car-savvy Tej (Chris ""Ludacris"" Bridges) and Suki (Devon Aoki), but his competitive streak ends when federal agents apprehend him and he must enter into a deal with the FBI. Working with new partner Roman Pearce (Tyrese), Brian begins a dangerous mission to take down a powerful drug dealer.
                ",Action,English,John Singleton,Neal H. Moritz,"Michael Brandt, Derek Haas, Michael Brandt, Derek Haas, Gary Scott Thompson","Jun 6, 2003 wide","Sep 30, 2003",1h 48m,Universal Pictures,Universal/Universal Int,Scope (2.35:1),PG-13 (Some Sensuality|Language|Street Racing|Violence),The Fast and the Furious,$127.1M,"Dolby A, Dolby Stereo, DTS, SDDS, Surround, Dolby SR, Dolby Digital"
61,https://www.rottentomatoes.com/m/top_gun_maverick,Top Gun: Maverick,"
                    After more than thirty years of service as one of the Navy’s top aviators, Pete “Maverick” Mitchell (Tom Cruise) is where he belongs, pushing the envelope as a courageous test pilot and dodging the advancement in rank that would ground him. When he finds himself training a detachment of Top Gun graduates for a specialized mission the likes of which no living pilot has ever seen, Maverick encounters Lt. Bradley Bradshaw (Miles Teller), call sign: “Rooster,” the son of Maverick’s late friend and Radar Intercept Officer Lt. Nick Bradshaw, aka “Goose”.

Facing an uncertain future and confronting the ghosts of his past, Maverick is drawn into a confrontation with his own deepest fears, culminating in a mission that demands the ultimate sacrifice from those who will be chosen to fly it.

                ","Action, Adventure",English,Joseph Kosinski,"Jerry Bruckheimer, Tom Cruise, David Ellison, Christopher McQuarrie","Ehren Kruger, Eric Warren Singer, Christopher McQuarrie","May 27, 2022 wide","Aug 22, 2022",2h 11m,Paramount Pictures,"Don Simpson/Jerry Bruckheimer Films, Paramount Pictures, Jerry Bruckheimer Films, Skydance Media",Scope (2.35:1),PG-13 (Some Strong Language|Sequences of Intense Action),,$718.5M,Dolby Atmos
62,https://www.rottentomatoes.com/m/aladdin,Aladdin,"
                    Aladdin is a lovable street urchin who meets Princess Jasmine, the beautiful daughter of the sultan of Agrabah. While visiting her exotic palace, Aladdin stumbles upon a magic oil lamp that unleashes a powerful, wisecracking, larger-than-life genie. As Aladdin and the genie start to become friends, they must soon embark on a dangerous mission to stop the evil sorcerer Jafar from overthrowing young Jasmine's kingdom.
                ","Kids & family, Musical, Comedy, Fantasy, Adventure, Romance",English,Guy Ritchie,"Dan Lin, Jonathan Eirich","John August, Guy Ritchie","May 24, 2019 wide","Aug 27, 2019",2h 8m,Walt Disney,Rideback,Scope (2.35:1),PG (Some Action/Peril),,$355.6M,"DTS, Dolby Digital, Dolby Atmos"
63,https://www.rottentomatoes.com/m/heat_1995,Heat,"
                    Master criminal Neil McCauley (Robert De Niro) is trying to control the rogue actions of one of his men, while also planning one last big heist before retiring. Meanwhile, Lieutenant Hanna (Al Pacino) attempts to track down McCauley as he deals with the chaos in his own life, including the infidelity of his wife (Diane Venora) and the mental health of his stepdaughter (Natalie Portman). McCauley and Hanna discover a mutual respect, even as they try to thwart each other's plans.
                ","Crime, Drama",English,Michael Mann,"Art Linson, Michael Mann",Michael Mann,"Dec 15, 1995 wide","Jul 27, 1999",2h 50m,Warner Bros.,"Warner Brothers, Regency Enterprises, Forward Pass",,R,,$66.2M,"Surround, Mono"
64,https://www.rottentomatoes.com/m/nope,Nope,"
                    A man and his sister discover something sinister in the skies above their California horse ranch, while the owner of a nearby theme park tries to profit from the mysterious, otherworldly phenomenon.
                ","Sci-fi, Horror, Mystery & thriller",English,Jordan Peele,"Jordan Peele, Ian Cooper",Jordan Peele,"Jul 22, 2022 wide","Nov 18, 2022",2h 15m,Universal Pictures,Monkeypaw Productions,,R (Some Violence/Bloody Images|Language Throughout),,$123.2M,"Dolby Digital, Dolby Atmos"
65,https://www.rottentomatoes.com/m/the_menu,The Menu,"
                    A couple (Anya Taylor-Joy and Nicholas Hoult) travels to a coastal island to eat at an exclusive restaurant where the chef (Ralph Fiennes) has prepared a lavish menu, with some shocking surprises.
                ","Horror, Mystery & thriller, Comedy",English,Mark Mylod,"Adam McKay, Betsy Koch, Will Ferrell","Seth Reiss, Will Tracy","Nov 18, 2022 wide","Jan 3, 2023",1h 47m,Searchlight Pictures,"Hyperobject Industries, Alienworx Productions",Digital 2.39:1,R (Some Sexual References|Language Throughout|Strong Violent Content),,$38.5M,"Dolby Atmos, Dolby Digital"
66,https://www.rottentomatoes.com/m/soft_and_quiet,Soft & Quiet,"
                    Playing out in real time, SOFT & QUIET is a runaway train that follows a single afternoon in the life of an elementary school teacher, Emily, who organizes an inaugural club meeting of like-minded women. When they all decide to move the meeting to Emily's house to keep the wine flowing, they stop at the local store to pick up refreshments. At the store, an altercation breaks out between a woman from Emily's past and the group, leading to a volatile chain of events.
                ","Horror, Mystery & thriller, Drama",English,Beth de Araújo,"Joshua Beirne-Golden, Josh Peters, Saba Zerehi, Beth de Araújo",Beth de Araújo,"Nov 4, 2022 limited","Nov 4, 2022",1h 32m,Momentum Pictures,"Blumhouse Productions, Second Grade Teacher",,,,,
67,https://www.rottentomatoes.com/m/emily_the_criminal,Emily the Criminal,"
                    Emily (Aubrey Plaza) is saddled with student debt and locked out of the job market due to a minor criminal record. Desperate for income, she takes a shady gig as a ""dummy shopper,"" buying goods with stolen credit cards supplied by a handsome and charismatic middleman named Youcef (Theo Rossi). Faced with a series of dead-end job interviews, Emily soon finds herself seduced by the quick cash and illicit thrills of black-market capitalism, and increasingly interested in her mentor Youcef. Together, they hatch a plan to bring their business to the next level in Los Angeles.
                ","Crime, Drama, Mystery & thriller",English,John Patton Ford,"Tyler Davidson, Aubrey Plaza, Drew Sykes",John Patton Ford,"Aug 12, 2022 wide","Oct 28, 2022",1h 37m,"Vertical Entertainment, Roadside Attractions",Low Spark Films,Scope (2.35:1),R (Language|Brief Drug Use|Some Violence),,$2.2M,
68,https://www.rottentomatoes.com/m/donnie_darko,Donnie Darko,"
                    In a funny, moving and distinctly mind-bending journey through suburban America, one extraordinary but disenchanted teenager is about to take Time's Arrow for a ride. After surviving a freak accident, Donnie (Jake Gyllenhaal) begins to explore what it means to be alive, and in short order to be in love, he uncovers secrets of the universe that give him a tempting power to alter time and destiny.
                ","Drama, Sci-fi, Fantasy",English,Richard Kelly,"Sean McKittrick, Nancy Juvonen",Richard Kelly,"Oct 26, 2001 wide","Feb 4, 2003",1h 53m,Newmarket Film Group,"Gaylord Films, Pandora Cinema, Adam Fields Productions, Flower Films",Scope (2.35:1),R (Some Drug Use|Language|Violence),,$205.8K,"Dolby Digital, Surround, Dolby A, Dolby Stereo, Dolby SR"
69,https://www.rottentomatoes.com/m/she_said,She Said,"
                    Two-time Academy Award® nominee Carey Mulligan (Promising Young Woman, An Education) and Zoe Kazan (The Plot Against America limited series, The Big Sick) star as New York Times reporters Megan Twohey and Jodi Kantor, who together broke one of the most important stories in a generation--a story that helped propel the #Metoo movement, shattered decades of silence around the subject of sexual assault in Hollywood and altered American culture forever.
                ",Drama,English,Maria Schrader,"Dede Gardner, Jeremy Kleiner",Rebecca Lenkiewicz,"Nov 18, 2022 wide","Jan 6, 2023",2h 9m,Universal Pictures,"Annapurna Pictures, Plan B",Flat (1.85:1),R (Language|Descriptions of Sexual Assault),,$5.8M,Dolby Digital
70,https://www.rottentomatoes.com/m/1004330-cleopatra,Cleopatra,"
                    ""Cleopatra"" is a lengthy, sprawling, spectacular love story, helmed by Joseph L. Mankiewicz, depicting Cleopatra's manipulation of Julius Caesar and Marc Antony in her ill-fated attempt to save the Egyptian empire. This threesome in one of the most famous and gloriously powerful love triangles ever to be captured on film.
                ","History, Drama",English,Joseph L. Mankiewicz,Walter Wanger,"Sidney Buchman, Carlo Mario Franzero, Ranald MacDougall, Joseph L. Mankiewicz","Jun 12, 1963 wide","Feb 7, 2006",4h 3m,20th Century Fox,Twentieth Century Fox,Scope (2.35:1),G,,,Stereo
71,https://www.rottentomatoes.com/m/influencer,Influencer,"
                    INFLUENCER tells the story of Madison (Emily Tennant, ""Riverdale""), a popular social media influencer who is having a lonely and uneventful trip in Thailand despite what she tells her followers on Instagram. While reflecting on her boyfriend canceling the trip, she meets CW (Cassandra Naud, ""See""), a fearless and enigmatic traveler who offers to take her to some of the most Instagram-worthy locations. Together they share authentic meals and drinks with locals, discussing the differences between Madison's online presence and CW's lack of one. After showing Madison all of the amazing sights, things take a different turn when CW brings her to a surprise location -- a deserted island that is completely off the grid.
                ","Horror, Mystery & thriller",English,Kurtis David Harder,"Kurtis David Harder, Tesh Guttikonda, Brandon Christensen, Jack Campbell, Micah Henry","Kurtis David Harder, Tesh Guttikonda, Kurtis David Harder, Tesh Guttikonda",,"May 26, 2023",1h 32m,Shudder,Octane Entertainment,Scope (2.35:1),,,,
72,https://www.rottentomatoes.com/m/raiders_of_the_lost_ark,Raiders of the Lost Ark,"
                    Dr. Indiana Jones, a renowned archeologist and expert in the occult, is hired by the U.S. Government to find the ark of the covenant, which is believed to still hold the Ten Commandments. Unfortunately, Hitler's agents are also after the ark. Indy and his ex-flame Marion escape from various close scrapes in a quest that takes them from Nepal to Cairo.
                ","Adventure, Action",English,Steven Spielberg,Frank Marshall,"Lawrence Kasdan, George Lucas, Philip Kaufman","Jun 12, 1981 wide","May 13, 2008",1h 55m,Paramount Pictures,"Paramount Pictures, Lucasfilm Ltd.",Scope (2.35:1),PG,Indiana Jones,$248.2M,"Dolby Stereo, Magnetic Stereo 6 Track, Surround"
73,https://www.rottentomatoes.com/m/furious_7,Furious 7,"
                    After defeating international terrorist Owen Shaw, Dominic Toretto (Vin Diesel), Brian O'Conner (Paul Walker) and the rest of the crew have separated to return to more normal lives. However, Deckard Shaw (Jason Statham), Owen's older brother, is thirsty for revenge. A slick government agent offers to help Dom and company take care of Shaw in exchange for their help in rescuing a kidnapped computer hacker who has developed a powerful surveillance program.
                ","Action, Adventure, Mystery & thriller",English,James Wan,"Neal H. Moritz, Vin Diesel, Michael Fottrell",Chris Morgan,"Apr 3, 2015 wide","Sep 15, 2015",2h 17m,Universal Pictures,Original Film,,PG-13 (Brief Strong Language|Action|Mayhem|Suggestive Content|Violence),The Fast and the Furious,$350.8M,"Dolby Digital, Datasat"
74,https://www.rottentomatoes.com/m/the_artifice_girl,The Artifice Girl,"
                    A team of special agents discovers a revolutionary new computer program to bait and trap online predators. After teaming up with the program's troubled developer, they soon find that the AI is rapidly advancing beyond its original purpose.
                ","Sci-fi, Mystery & thriller",English,Franklin Ritch,"Aaron B. Koontz, Ashleigh Snead",Franklin Ritch,"Apr 27, 2023 limited","Apr 27, 2023",1h 33m,XYZ Films,"Paper Street Pictures, Last Resort Ideas, Blood Oath",,,,,
75,https://www.rottentomatoes.com/m/leave_no_trace,Leave No Trace,"
                    A father and daughter live a perfect but mysterious existence in Forest Park, a beautiful nature reserve near Portland, Ore., rarely making contact with the world. But when a small mistake tips them off to authorities, they are sent on an increasingly erratic journey in search of a place to call their own.
                ",Drama,English,Debra Granik,"Anne Harrison, Linda Reisman, Anne Rosellini","Debra Granik, Anne Rosellini","Jun 29, 2018 limited","Oct 2, 2018",1h 48m,Bleecker Street Media,"Harrison Productions, Still Rolling Productions",,PG (Thematic Material Throughout),,$6.0M,
76,https://www.rottentomatoes.com/m/fast_and_furious_presents_hobbs_and_shaw,Fast & Furious Presents: Hobbs & Shaw,"
                    Brixton Lorr is a cybernetically enhanced soldier who possesses superhuman strength, a brilliant mind and a lethal pathogen that could wipe out half of the world's population. It's now up to hulking lawman Luke Hobbs and lawless operative Deckard Shaw to put aside their past differences and work together to prevent the seemingly indestructible Lorr from destroying humanity.
                ","Action, Adventure, Comedy",English,David Leitch,"Dwayne Johnson, Jason Statham, Chris Morgan, Hiram Garcia","Chris Morgan, Drew Pearce","Aug 2, 2019 wide","Aug 27, 2019",2h 18m,Universal Pictures,"Chris Morgan Productions, Seven Bucks Productions",Scope (2.35:1),PG-13 (Some Strong Language|Prolonged Sequences of Action|Suggestive Material|Violence),The Fast and the Furious,$173.8M,"DTS, Dolby Atmos"
77,https://www.rottentomatoes.com/m/sisu_2022,Sisu,"
                    During the last desperate days of WWII, a solitary prospector (Jorma Tommila) crosses paths with Nazis on a scorched-earth retreat in northern Finland. When the Nazis steal his gold, they quickly discover that they have just tangled with no ordinary miner. While there is no direct translation for the Finnish word ""sisu"", this legendary ex-commando will embody what sisu means: a white-knuckled form of courage and unimaginable determination in the face of overwhelming odds. And no matter what the Nazis throw at him, the one-man death squad will go to outrageous lengths to get his gold back -- even if it means killing every last Nazi in his path.
                ","Action, War",Finnish,Jalmari Helander,Petri Jokiranta,Jalmari Helander,"Apr 28, 2023 wide","May 16, 2023",1h 31m,Lionsgate,"Subzero Film Entertainment, Good Chaos",Digital 2.39:1,R (Strong Bloody Violence|Language|Gore),,$7.1M,Dolby Digital
78,https://www.rottentomatoes.com/m/hereditary,Hereditary,"
                    When the matriarch of the Graham family passes away, her daughter and grandchildren begin to unravel cryptic and increasingly terrifying secrets about their ancestry, trying to outrun the sinister fate they have inherited.
                ","Horror, Mystery & thriller",English,Ari Aster,"Kevin Scott Frakes, Lars Knudsen, Buddy Patrick",Ari Aster,"Jun 8, 2018 wide","Sep 4, 2018",2h 7m,A24,PalmStar Media,,R (Disturbing Images|Brief Graphic Nudity|Drug Use|Horror Violence|Language),,$44.1M,Dolby Digital
79,https://www.rottentomatoes.com/m/the_fate_of_the_furious,The Fate of the Furious,"
                    With Dom and Letty married, Brian and Mia retired and the rest of the crew exonerated, the globe-trotting team has found some semblance of a normal life. They soon face an unexpected challenge when a mysterious woman named Cipher forces Dom to betray them all. Now, they must unite to bring home the man who made them a family and stop Cipher from unleashing chaos.
                ","Action, Adventure, Mystery & thriller",English,F. Gary Gray,"Neal H. Moritz, Vin Diesel, Michael Fottrell, Chris Morgan",Chris Morgan,"Apr 14, 2017 wide","Jul 11, 2017",2h 16m,Universal Pictures,"Original Film, One Race Films",Scope (2.35:1),PG-13 (Language|Destruction|Sequences of Violence|Suggestive Content),The Fast and the Furious,$225.7M,"Dolby Atmos, Datasat, Dolby Digital"
80,https://www.rottentomatoes.com/m/the_little_mermaid_1989,The Little Mermaid,"
                    In Disney's beguiling animated romp, rebellious 16-year-old mermaid Ariel (Jodi Benson) is fascinated with life on land. On one of her visits to the surface, which are forbidden by her controlling father, King Triton, she falls for a human prince. Determined to be with her new love, Ariel makes a dangerous deal with the sea witch Ursula (Pat Carroll) to become human for three days. But when plans go awry for the star-crossed lovers, the king must make the ultimate sacrifice for his daughter.
                ","Kids & family, Fantasy, Animation",English,"Ron Clements, John Musker","Howard Ashman, John Musker","Roger Allers, Ron Clements, John Musker","Nov 15, 1989 original","Oct 1, 2013",1h 22m,"BV International Pictures [no], Buena Vista Distribution Co. Inc.","Walt Disney Pictures, Silver Screen Partners IV",35mm,G,,$109.9M,"Surround, Magnetic Stereo 6 Track, Stereo"
81,https://www.rottentomatoes.com/m/wild_life_2023,Wild Life,"
                    WILD LIFE follows conservationist Kris Tompkins on an epic, decades-spanning love story as wild as the landscapes she dedicated her life to protecting. After falling in love in mid-life, Kris and the outdoorsman and entrepreneur Doug Tompkins left behind the world of the massively successful outdoor brands they'd helped pioneer -- Patagonia, The North Face, and Esprit -- and turned their attention to a visionary effort to create National Parks throughout Chile and Argentina. WILD LIFE chronicles the highs and lows of their journey to effect the largest private land donation in history.
                ","Documentary, Nature",English,"Jimmy Chin, Elizabeth Chai Vasarhelyi","Elizabeth Chai Vasarhelyi, Jimmy Chin, Bob Eisenhardt, Anna Barnes",,"Apr 14, 2023 limited","May 26, 2023",1h 33m,Picturehouse,"National Geographic, National Geographic Documentary Films, Little Monster Films",,PG-13 (Brief Strong Language),,$317.4K,Dolby Digital
82,https://www.rottentomatoes.com/m/peter_pan_and_wendy,Peter Pan & Wendy,"
                    Based on J. M. Barrie's novel ""Peter and Wendy"" and inspired by the 1953 animated classic, ""Peter Pan & Wendy"" is the timeless tale of a young girl who, defying her parents' wishes to attend boarding school, travels with her two younger brothers to the magical Neverland. There, she meets a boy who refuses to grow up, a tiny fairy and an evil pirate captain, and they soon find themselves on a thrilling and dangerous adventure far, far away from their family and the comforts of home.
                ","Kids & family, Fantasy, Adventure",English,David Lowery,James Whitaker,"David Lowery, Toby Halbrooks",,"Apr 28, 2023",1h 46m,Disney+,Whitaker Entertainment,,PG (Peril|Violence|Thematic Elements),,,"Dolby Digital, Dolby Atmos"
83,https://www.rottentomatoes.com/m/babylon_2022,Babylon,"
                    A tale of outsized ambition and outrageous excess, Babylon traces the rise and fall of multiple characters during an era of unbridled decadence and depravity in early Hollywood.
                ","Comedy, Drama",English,Damien Chazelle,"Marc Platt, Matthew Plouffe, Olivia Hamilton",Damien Chazelle,"Dec 23, 2022 wide","Jan 31, 2023",3h 9m,Paramount Pictures,"Marc Platt Productions, Organism Pictures, Wild Chickens",Digital 2.39:1,R (Drug Use|Bloody Violence|Graphic Nudity|Pervasive Language|Strong & Crude Sexual Content),,$15.2M,"Dolby Digital, Dolby Atmos"
84,https://www.rottentomatoes.com/m/dune_2021,Dune,"
                    Paul Atreides, a brilliant and gifted young man born into a great destiny beyond his understanding, must travel to the most dangerous planet in the universe to ensure the future of his family and his people. As malevolent forces explode into conflict over the planet's exclusive supply of the most precious resource in existence, only those who can conquer their own fear will survive.
                ","Sci-fi, Adventure, Action, Drama",English,Denis Villeneuve,"Denis Villeneuve, Mary Parent, Cale Boyter, Joseph Caracciolo Jr.","Jon Spaihts, Denis Villeneuve, Eric Roth","Oct 22, 2021 wide","Oct 22, 2021",2h 35m,Warner Bros. Pictures,"Legendary Pictures, Warner Bros., Villeneuve Films",Scope (2.35:1),PG-13 (Some Disturbing Images|Sequences of Strong Violence|Suggestive Material),,$108.3M,"Dolby Digital, Dolby Atmos"
85,https://www.rottentomatoes.com/m/john_wick_chapter_4,John Wick: Chapter 4,"
                    John Wick (Keanu Reeves) uncovers a path to defeating The High Table. But before he can earn his freedom, Wick must face off against a new enemy with powerful alliances across the globe and forces that turn old friends into foes.
                ",Action,English,Chad Stahelski,"Basil Iwanyk, Erica Lee, Chad Stahelski","Shay Hatten, Michael Finch","Mar 24, 2023 wide","May 23, 2023",2h 49m,Lionsgate,"Summit Entertainment, 87eleven, Thunder Road Pictures",Digital 2.39:1,R (Some Language|Pervasive Strong Violence),,$185.3M,Dolby Atmos
86,https://www.rottentomatoes.com/m/cracked_2022,Cracked,"
                    Ruja (actress/model Chayanit Chansangavej) returns to Thailand from New York with her young daughter Rachel to settle her late father's estate. Included in her inheritance are two mysterious portraits of a bewitching woman that she is told are worth a fortune, if only they weren't damaged. Desperate to sell the paintings, Ruja hires Tim (K-pop star Nichkhun), an art restorer, to prepare the canvases for sale. But the cracks in the paint have begun to reveal long-hidden secrets, and as strange phenomena begin to emerge around them, Ruja and Rachel quickly realize their lives are in grave danger.
                ","Horror, Mystery & thriller",Thai,Surapong Ploensang,,"Surapong Ploensang, Pun Homchuen, Eakasit Thairaat, Ornusa Donsawai",,"May 26, 2023",1h 33m,Film Movement,CJ MAJOR Entertainment,,,,,
87,https://www.rottentomatoes.com/m/everything_everywhere_all_at_once,Everything Everywhere All at Once,"
                    Directed by Daniel Kwan and Daniel Scheinert, collectively known as Daniels, the film is a hilarious and big-hearted sci-fi action adventure about an exhausted Chinese American woman (Michelle Yeoh) who can't seem to finish her taxes.
                ","Comedy, Adventure, Sci-fi, Fantasy",English,"Dan Kwan, Daniel Scheinert","Joe Russo, Anthony Russo, Mike Larocca, Dan Kwan, Daniel Scheinert, Jonathan Wang","Dan Kwan, Daniel Scheinert","Apr 8, 2022 wide","Jun 7, 2022",2h 12m,A24,"Ley Line Entertainment, IAC Films, AGBO",Flat (1.85:1),R (Sexual Material|Language|Some Violence),,$76.7M,Dolby Digital
88,https://www.rottentomatoes.com/m/creed_iii,Creed III,"
                    After dominating the boxing world, Adonis Creed (Michael B. Jordan) has been thriving in both his career and family life. When a childhood friend and former boxing prodigy, Damian (Jonathan Majors), resurfaces after serving a long sentence in prison, he is eager to prove that he deserves his shot in the ring. The face off between former friends is more than just a fight. To settle the score, Adonis must put his future on the line to battle Damian -- a fighter who has nothing to lose.
                ","Drama, Action",English,Michael B. Jordan,"Irwin Winkler, Charles Winkler, William Chartoff, David Winkler, Ryan Coogler, Michael B. Jordan, Elizabeth Raposo, Jonathan Glickman, Sylvester Stallone","Keenan Coogler, Zach Baylin","Mar 3, 2023 wide","Mar 31, 2023",1h 56m,United Artists Releasing,"Proximity, Chartoff-Winkler Productions, Glickmania, Metro-Goldwyn-Mayer (MGM), Outlier Society",Digital 2.39:1,PG-13 (Some Strong Language|Intense Sports Action|Violence),Rocky,$156.2M,Dolby Digital
89,https://www.rottentomatoes.com/m/the_fabelmans,The Fabelmans,"
                    Young Sammy Fabelman falls in love with movies after his parents take him to see ""The Greatest Show on Earth."" Armed with a camera, Sammy starts to make his own films at home, much to the delight of his supportive mother.
                ",Drama,English,Steven Spielberg,"Kristie Macosko Krieger, Steven Spielberg, Tony Kushner","Steven Spielberg, Tony Kushner","Nov 23, 2022 wide","Dec 13, 2022",2h 31m,Universal Pictures,"Universal Pictures, Amblin Entertainment, Reliance Entertainment, Amblin Partners",Flat (1.85:1),PG-13 (Drug Use|Brief Violence|Some Strong Language|Thematic Elements),,$17.3M,Dolby Digital
90,https://www.rottentomatoes.com/m/ad_astra,Ad Astra,"
                    Thirty years ago, Clifford McBride led a voyage into deep space, but the ship and crew were never heard from again. Now his son -- a fearless astronaut -- must embark on a daring mission to Neptune to uncover the truth about his missing father and a mysterious power surge that threatens the stability of the universe.
                ","Sci-fi, Adventure, Mystery & thriller",English,James Gray,"Anthony Katagas, Rodrigo Teixeira, Arnon Milchan, James Gray, Jeremy Kleiner, Dede Gardner, Brad Pitt","James Gray, Ethan Gross","Sep 20, 2019 wide","Sep 20, 2019",2h 4m,20th Century Fox,"20th Century Fox, New Regency Pictures, RT Features, Plan B Entertainment, Bona Film Group, MadRiver Pictures, Keep Your Head",Scope (2.35:1),PG-13 (Brief Strong Language|Bloody Images|Some Violence),,$50.2M,"Dolby Atmos, DTS, SDDS, Datasat"
