31,https://www.rottentomatoes.com/m/still_a_michael_j_fox_movie,Still: A Michael J. Fox Movie,"
                    The film, which will incorporate documentary, archival and scripted elements, will recount Fox's extraordinary story in his own words -- the improbable tale of an undersized kid from a Canadian army base who rose to the heights of stardom in 1980s Hollywood. The account of Fox's public life, full of nostalgic thrills and cinematic gloss, will unspool alongside his never-before-seen private journey, including the years that followed his diagnosis, at 29, with Parkinson's disease. Intimate and honest, and produced with unprecedented access to Fox and his family, the film will chronicle Fox's personal and professional triumphs and travails, and will explore what happens when an incurable optimist confronts an incurable disease. With a mix of adventure and romance, comedy and drama, watching the film will feel like... well, like a Michael J. Fox movie.
                ","Documentary, Biography",English,Davis Guggenheim,"Davis Guggenheim, Annetta Marion, Jonathan King",,"May 12, 2023 limited","May 12, 2023",1h 35m,Apple Original Films,Concordia Studio,,R (Language),,,
32,https://www.rottentomatoes.com/m/tetris,Tetris,"
                    ""Tetris"" tells the unbelievable story of how one of the world's most popular video games found its way to avid players around the globe. Henk Rogers (Taron Egerton) discovers TETRIS in 1988, and then risks everything by traveling to the Soviet Union, where he joins forces with inventor Alexey Pazhitnov (Nikita Efremov) to bring the game to the masses. Based on a true story, ""Tetris"" is a Cold War-era thriller on steroids, with double-crossing villains, unlikely heroes and a nail-biting race to the finish.
                ","Mystery & thriller, Biography, Drama",English,Jon S. Baird,"Gillian Berrie, Len Blavatnik, Gregor Cameron, Claudia Schiffer, Matthew Vaughn",Noah Pink,"Mar 24, 2023 limited","Mar 31, 2023",1h 58m,Apple TV+,"Marv Films, AI-Film",Digital 2.39:1,R (Language),,,Dolby Digital
33,https://www.rottentomatoes.com/m/indiana_jones_and_the_kingdom_of_the_crystal_skull,Indiana Jones and the Kingdom of the Crystal Skull,"
                    It's the height of the Cold War, and famous archaeologist Indiana Jones (Harrison Ford), returning from his latest adventure, finds out his job at Marshall College is in jeopardy. He meets Mutt (Shia La Beouf), a young man who wants Indy to help him find the legendary Crystal Skull of Akator, and the pair set out for Peru. However, deadly agent Irina Spalko (Cate Blanchett) is searching for the powerful artifact, too, because the Soviets believe it can help them conquer the world.
                ","Adventure, Action",English,Steven Spielberg,Frank Marshall,David Koepp,"May 22, 2008 wide","Oct 14, 2008",2h 2m,Paramount Pictures,Lucasfilm Ltd.,Scope (2.35:1),PG-13 (Scary Images|Adventure Violence),Indiana Jones,$317.0M,"SDDS, DTS, Dolby Digital"
34,https://www.rottentomatoes.com/m/renfield,Renfield,"
                    In this modern monster tale of Dracula's loyal servant, Nicholas Hoult (Mad Max: Fury Road, X-Men franchise) stars as Renfield, the tortured aide to history's most narcissistic boss, Dracula (Oscar® winner Nicolas Cage). Renfield is forced to procure his master's prey and do his every bidding, no matter how debased. But now, after centuries of servitude, Renfield is ready to see if there's a life outside the shadow of The Prince of Darkness. If only he can figure out how to end his codependency.
                ","Horror, Comedy, Fantasy",English,Chris McKay,"Robert Kirkman, David Alpert, Bryan Furst, Sean Furst, Chris McKay",Ryan Ridley,"Apr 14, 2023 wide","May 2, 2023",1h 33m,Universal Pictures,Skybound Entertainment,Digital 2.39:1,R (Language Throughout|Bloody Violence|Some Drug Use|Some Gore),,$17.1M,Dolby Digital
35,https://www.rottentomatoes.com/m/the_whale_2022,The Whale,"
                    A reclusive English teacher suffering from severe obesity attempts to reconnect with his estranged teenage daughter for one last chance at redemption.
                ",Drama,English,Darren Aronofsky,,Samuel D. Hunter,"Dec 21, 2022 wide","Feb 21, 2023",1h 57m,A24,Protozoa Pictures,,R (Sexual Content|Language|Some Drug Use),,$17.2M,Dolby Digital
36,https://www.rottentomatoes.com/m/a_new_old_play,A New Old Play,"
                    One evening in the 1980s, Qiu Fu, a leading clown in 20th-century Sichuan opera, departs this world and must reluctantly set off for the Ghost City under the escort of two underworld officials. Along the way, he meets old friends. As they recall the past, earthly scenes creep into the mists of the Netherworld. Qiu Fu's life in opera unfolds against the backdrop of a secular upheaval. The ""New-New"" Troupe in which he grows up and learns his trade is affiliated with the military. As power shifts, the troupe is cast loose to wander rootlessly through a broken world. Despite this unsettled destiny, shaped by war, famine and political turmoil, Qiu Fu becomes one of the finest clown-role performers in Sichuan opera. And yet, one day he finds himself clapped in a pigsty as a political revolution rages outside. Outside the Ghost City, sitting among familiar faces, Qiu Fu drinks the mandatory bowl of Forgetfulness Soup to erase his memory. A lifetime of hardship, pain and sorrow, all vanish as if they had never been.
                ",Drama,Chinese,Qiu Jiongjiong,"Ding Ding, Yang Jin",Qiu Jiongjiong,"May 20, 2022 limited","May 16, 2023",2h 59m,Icarus Films,,,,,,
37,https://www.rottentomatoes.com/m/bama_rush,Bama Rush,"
                    In August 2021, the long-held tradition of sorority recruitment at the University of Alabama, also known as rush, went viral on TikTok.  Becoming a viral sensation and cultural phenomenon using the hash tag “Bama Rush,” to date more than 2 billion people have watched.  In the upcoming feature documentary BAMA RUSH, Fleit follows four young women as they prepare to rush at the university in 2022.  In this documentary, Fleit explores the emotional complexities and stakes of belonging in this crucial window into womanhood. 
                ",Documentary,English,Rachel Fleit,"Andrew Freston, Danny Gabai, Zachary Luke Kislevitz",,,"May 23, 2023",,Max,,,,,,
38,https://www.rottentomatoes.com/m/evil_dead_rise,Evil Dead Rise,"
                    In the fifth Evil Dead film, a road-weary Beth pays an overdue visit to her older sister Ellie, who is raising three kids on her own in a cramped L.A apartment. The sisters' reunion is cut short by the discovery of a mysterious book deep in the bowels of Ellie's building, giving rise to flesh-possessing demons, and thrusting Beth into a primal battle for survival as she is faced with the most nightmarish version of motherhood imaginable.
                ","Horror, Mystery & thriller, Fantasy",English,Lee Cronin,Rob Tapert,Lee Cronin,"Apr 21, 2023 wide","May 9, 2023",1h 37m,Warner Bros. Pictures,"Warner Bros., Department of Post, Pacific Renaissance, New Line Cinema, Wild Atlantic Pictures, Ghost House Pictures",Digital 2.39:1,R (Strong Bloody Horror Violence|Some Language|Gore),Evil Dead,$64.2M,"Dolby Digital, Dolby Atmos"
39,https://www.rottentomatoes.com/m/fast_and_furious_6,Fast & Furious 6,"
                    Since Dom (Vin Diesel) and Brian's (Paul Walker) heist in Rio left them and their crew very rich people, they've scattered across the globe; however, they must still live as fugitives, unable to return home to their families. Meanwhile, Agent Hobbs (Dwayne Johnson) has been tracking a gang of lethally skilled mercenary drivers whose second-in-command is someone Dom knows. Unable to take them down himself, Hobbs asks Dom and his crew for help in exchange for full pardons for everyone.
                ",Action,English,Justin Lin,"Neal H. Moritz, Vin Diesel, Clayton Townsend",Chris Morgan,"May 24, 2013 wide","Oct 29, 2013",2h 10m,Universal Pictures,"Original Film, One Race Productions",,PG-13 (Intense Sequences of Violence|Intense Sequences of Action|Language|Mayhem Throughout|Some Sexuality),The Fast and the Furious,$238.7M,"Datasat, SDDS, Dolby Digital"
40,https://www.rottentomatoes.com/m/plane,Plane,"
                    In the white-knuckle action movie PLANE, pilot Brodie Torrance (Gerard Butler) saves his passengers from a lightning strike by making a risky landing on a war-torn island -- only to find that surviving the landing was just the beginning. When most of the passengers are taken hostage by dangerous rebels, the only person Torrance can count on for help is Louis Gaspare (Mike Colter), an accused murderer who was being transported by the FBI. In order to rescue the passengers, Torrance will need Gaspare's help, and will learn there's more to Gaspare than meets the eye.
                ","Action, Adventure, Mystery & thriller",English,Jean-François Richet,"Lorenzo di Bonaventura, Mark Vahradian, Marc Butan, Gerard Butler, Alan Siegel, Jason Constantine, Eda Kowan, Ara Keshishian","Charles Cumming, J.P. Davis","Jan 13, 2023 wide","Feb 2, 2023",1h 47m,Lionsgate,"G-BASE, MadRiver Pictures, Di Bonaventura Pictures, Olive Hill Media, The Searchers NV",Scope (2.35:1),R (Violence and Language),,$32.1M,
41,https://www.rottentomatoes.com/m/big_george_foreman_the_miraculous_story_of_the_once_and_future_heavyweight_champion_of_the_world,Big George Foreman: The Miraculous Story of the Once and Future Heavyweight Champion of the World,"
                    Big George Foreman: The Miraculous Story of the Once and Future Heavyweight Champion of the World is based on the remarkable true story of one of the greatest comebacks of all time and the transformational power of second chances. Fueled by an impoverished childhood, Foreman channeled his anger into becoming an Olympic Gold medalist and World Heavyweight Champion, followed by a near-death experience that took him from the boxing ring to the pulpit. But when he sees his community struggling spiritually and financially, Foreman returns to the ring and makes history by reclaiming his title, becoming the oldest and most improbable World Heavyweight Boxing Champion ever.
                ","Biography, Drama, Sports",English,George Tillman Jr.,David Zelon,"Frank Baldwin, George Tillman Jr., Dan Gordon","Apr 28, 2023 wide","May 16, 2023",2h 9m,Columbia Pictures,"Mandalay Pictures, State Street Pictures, Affirm Films",,PG-13 (Some Sports Violence),,$5.3M,Dolby Digital
42,https://www.rottentomatoes.com/m/being_mary_tyler_moore,Being Mary Tyler Moore,"
                    Chronicling the vanguard career of Mary Tyler Moore, weaving her personal narrative with the beats of her professional accomplishments, highlighting her groundbreaking roles and the indelible impact she had on generations of women who came after her.
                ","Documentary, Biography",English,James Adolphus,"James Adolphus, Debra Martin Chase, Andrew Coles, Laura Gardner, Rishi Rajani, Ben Selkow, Lena Waithe",,,"May 26, 2023",1h 59m,HBO,"HBO Documentary Films, Fifth Season, Hillman Grad",,,,,
43,https://www.rottentomatoes.com/m/knock_at_the_cabin,Knock at the Cabin,"
                    While vacationing at a remote cabin, a young girl and her parents are taken hostage by four armed strangers who demand that the family make an unthinkable choice to avert the apocalypse. With limited access to the outside world, the family must decide what they believe before all is lost.
                ","Mystery & thriller, Drama",English,M. Night Shyamalan,"M. Night Shyamalan, Marc Bienstock, Ashwin Rajan","M. Night Shyamalan, Steve Desmond, Michael Sherman","Feb 3, 2023 wide","Feb 21, 2023",1h 40m,Universal Pictures,"Wishmore, FilmNation, Universal Studios, Dentsu, Blinding Edge Pictures, Perfect World Pictures",Digital 2.39:1,R (Violence and Language),,$35.4M,"Dolby Digital, Dolby Atmos"
44,https://www.rottentomatoes.com/m/mobking,MobKing,"
                    After returning home from a lengthy prison sentence, a loyal crime family confidant quickly realizes that he and his family are the targets of the organization that he remained devoted to all of his life. In order to save his family, he must choose whether to run or fight back.
                ","Drama, Mystery & thriller",English,Jokes Yanes,"Antoni Corone, Jokes Yanes, Cristy Trabadass","Jokes Yanes, J. Bishop, Cristy Trabadass, Ciro Dapagio","May 26, 2023 limited","May 26, 2023",1h 29m,Gravitas Ventures,"Button Man Films, Mainman Productions, Ciro Dapagio Films",,,,,
45,https://www.rottentomatoes.com/m/ghosted_2023,Ghosted,"
                    Salt-of-the-earth Cole (Chris Evans) falls head over heels for enigmatic Sadie (Ana de Armas)--but then makes the shocking discovery that she's a secret agent. Before they can decide on a second date, Cole and Sadie are swept away on an international adventure to save the world.
                ","Action, Romance, Adventure",English,Dexter Fletcher,"Jules Daly, David Ellison, Chris Evans, Dana Goldberg, Don Granger, Rhett Reese, Paul Wernick","Chris McKenna, Rhett Reese, Paul Wernick",,"Apr 21, 2023",1h 56m,Apple TV+,"Apple Original Films, Studio Concierge, Skydance Media",,PG-13 (Brief Strong Language|Some Sexual Content|Seq. of Strong violence/Action),,,
46,https://www.rottentomatoes.com/m/avengers_endgame,Avengers: Endgame,"
                    Adrift in space with no food or water, Tony Stark sends a message to Pepper Potts as his oxygen supply starts to dwindle. Meanwhile, the remaining Avengers -- Thor, Black Widow, Captain America and Bruce Banner -- must figure out a way to bring back their vanquished allies for an epic showdown with Thanos -- the evil demigod who decimated the planet and the universe.
                ","Action, Adventure, Fantasy, Sci-fi",English,"Anthony Russo, Joe Russo",Kevin Feige,"Christopher Markus, Stephen McFeely","Apr 26, 2019 wide","Jul 30, 2019",3h 1m,Walt Disney,"Marvel Studios, Walt Disney Pictures",Scope (2.35:1),PG-13 (Sequences of Sci-Fi Violence|Action|Some Language),Marvel Cinematic Universe,$858.4M,"DTS, Dolby Digital, SDDS, Dolby Atmos"
47,https://www.rottentomatoes.com/m/white_men_cant_jump_2023,White Men Can't Jump,"
                    From 20th Century Studios, the all-new comedy ""White Men Can't Jump"" is a modern remix of the iconic 1992 film that celebrates the streetball hustling culture of Los Angeles. Multi-platinum rap superstar Jack Harlow makes his movie debut as Jeremy, a former star of the game whose injuries stalled his career, and Sinqua Walls stars as Kamal, once a promising player who derailed his own future in the sport. Juggling tenuous relationships, financial pressures and serious internal struggles, the two ballers--opposites who are seemingly miles apart--find they might have more in common than they imagined possible.
                ","Comedy, Drama, Sports",English,Calmatic,"Kenya Barris, Paul Hall","Kenya Barris, Doug Hall",,"May 19, 2023",1h 41m,Hulu,"Khalabo Ink Society, Mortal Media, 20th Century Studios",,R (Pervasive Language|Some Drug Material),,,Dolby Digital
48,https://www.rottentomatoes.com/m/1108372-fast_and_the_furious,The Fast and the Furious,"
                    Dominic Toretto (Vin Diesel) enjoys the adrenaline of street car racing and his fans treat him like a rock star. After a blazing encounter with the ruthless Johnny Tran, Dom decides to take Brian (Paul Walker), a newcomer to street racing, under his wing. Dom's sister Mia sees something she likes in Brian, too. Trouble is, neither of them realize he's an undercover cop, and Dominic and his rival Johnny Tran are both the prime suspects in a case involving dirty money and big-rig hijacking.
                ","Action, Adventure",English,Rob Cohen,Neal H. Moritz,"Gary Scott Thompson, Erik Bergquist, David Ayer, Gary Scott Thompson","Jun 22, 2001 wide","Jun 3, 2003",1h 47m,Universal Pictures,"Universal Pictures, Neal H. Moritz Productions, Original Film",Scope (2.35:1),PG-13 (Sexual Content|Language|Violence),The Fast and the Furious,$144.5M,"Dolby A, Dolby Stereo, DTS, SDDS, Surround, Dolby SR, Dolby Digital"
49,https://www.rottentomatoes.com/m/cocaine_shark,Cocaine Shark,"
                    A new, highly addictive stimulant is on the streets called HT25, derived from sharks, which causes monstrous side effects; after a leak at the lab, mutated sharks and other creatures are set loose, as a small band of people tries to stop the carnage.
                ",Horror,English,Mark Polonia,Rob Hauschild,,,"Jul 11, 2023",1h 10m,Wild Eye Releasing,,,,,,
50,https://www.rottentomatoes.com/m/thor_love_and_thunder,Thor: Love and Thunder,"
                    ""Thor: Love and Thunder"" finds Thor (Chris Hemsworth) on a journey unlike anything he's ever faced -- a quest for inner peace. But his retirement is interrupted by a galactic killer known as Gorr the God Butcher (Christian Bale), who seeks the extinction of the gods. To combat the threat, Thor enlists the help of King Valkyrie (Tessa Thompson), Korg (Taika Waititi) and ex-girlfriend Jane Foster (Natalie Portman), who -- to Thor's surprise -- inexplicably wields his magical hammer, Mjolnir, as the Mighty Thor. Together, they embark upon a harrowing cosmic adventure to uncover the mystery of the God Butcher's vengeance and stop him before it's too late.
                ","Action, Adventure, Fantasy, Comedy",English,Taika Waititi,Kevin Feige,"Taika Waititi, Jennifer Kaytin Robinson","Jul 8, 2022 wide","Sep 8, 2022",2h 5m,Walt Disney Pictures,"Marvel Studios, Walt Disney Pictures, Fox Studios Australia",Scope (2.35:1),PG-13 (Intense Sci-Fi Violence|Action|Language|Partial Nudity|Some Suggestive Material),Marvel Cinematic Universe,$343.2M,"Dolby Atmos, Dolby Digital"
51,https://www.rottentomatoes.com/m/interstellar_2014,Interstellar,"
                    In Earth's future, a global crop blight and second Dust Bowl are slowly rendering the planet uninhabitable. Professor Brand (Michael Caine), a brilliant NASA physicist, is working on plans to save mankind by transporting Earth's population to a new home via a wormhole. But first, Brand must send former NASA pilot Cooper (Matthew McConaughey) and a team of researchers through the wormhole and across the galaxy to find out which of three planets could be mankind's new home.
                ","Sci-fi, Adventure, Action",English,Christopher Nolan,"Emma Thomas, Christopher Nolan, Lynda Obst","Jonathan Nolan, Christopher Nolan","Nov 7, 2014 wide","Mar 31, 2015",2h 45m,Paramount Pictures,"Syncopy, Lynda Obst Productions",,PG-13 (Some Intense Perilous Action|Brief Strong Language),,$188.0M,"Dolby Digital, Datasat"
52,https://www.rottentomatoes.com/m/missing_2023,Missing,"
                    When her mother (Nia Long) disappears while on vacation in Colombia with her new boyfriend, June's (Storm Reid) search for answers is hindered by international red tape. Stuck thousands of miles away in Los Angeles, June creatively uses all the latest technology at her fingertips to try and find her before it's too late. But as she digs deeper, her digital sleuthing raises more questions than answers... and when June unravels secrets about her mom, she discovers that she never really knew her at all.
                ",Mystery & thriller,English,"Will Merrick, Nicholas D. Johnson","Natalie Qasabian, Sev Ohanian, Aneesh Chaganty","Will Merrick, Nicholas D. Johnson","Jan 20, 2023 wide","Mar 7, 2023",1h 51m,Screen Gems,"Bazelevs Production, Sony Pictures, Search Party",Flat (1.85:1),PG-13 (Some Strong Violence|Language|Teen Drinking|Thematic Material),,$32.4M,
53,https://www.rottentomatoes.com/m/x_2022,X,"
                    In 1979, a group of young filmmakers set out to make an adult film in rural Texas, but when their reclusive, elderly hosts catch them in the act, the cast find themselves fighting for their lives.
                ","Horror, Mystery & thriller",English,Ti West,"Jacob Jaffke, Kevin Turen, Harrison Kreiss",Ti West,"Mar 18, 2022 wide","Apr 14, 2022",1h 45m,A24,"A24, MAD SOLAR, BRON Creative",,R (Gore|Drug Use|Strong Sexual Content|Graphic Nudity|Language|Strong Bloody Violence),,$11.6M,
54,https://www.rottentomatoes.com/m/m3gan,M3GAN,"
                    M3GAN is a marvel of artificial intelligence, a life-like doll programmed to be a child's greatest companion and a parent's greatest ally. Designed by brilliant toy-company roboticist Gemma (Get Out's Allison Williams), M3GAN can listen and watch and learn as she becomes friend and teacher, playmate and protector, for the child she is bonded to. When Gemma suddenly becomes the caretaker of her orphaned 8-year-old niece, Cady (Violet McGraw, The Haunting of Hill House), Gemma's unsure and unprepared to be a parent. Under intense pressure at work, Gemma decides to pair her M3GAN prototype with Cady in an attempt to resolve both problems--a decision that will have unimaginable consequences.
                ","Horror, Mystery & thriller, Sci-fi, Comedy",English,Gerard Johnstone,"Jason Blum, James Wan, Couper Samuelson",Akela Cooper,"Jan 6, 2023 wide","Jan 24, 2023",1h 42m,Universal Pictures,"Blumhouse Productions, Atomic Monster",Digital 2.39:1,PG-13 (Some Strong Language|A Suggestive Reference|Terror|Violent Content),,$95.0M,Dolby Digital
55,https://www.rottentomatoes.com/m/days_of_daisy,Days of Daisy,"
                    Daisy Bea spends her days as a high school librarian, stuck in a rut with both her personal and professional life. As her 40th birthday approaches, she starts to feel pressured to settle down and start a family. When the art teacher at Daisy's school abruptly quits mid-term, Daisy takes it upon herself to give West High School students the art program that they deserve. Through her adopted profession, she begins to question the true meaning of parenthood and how she fits within those boundaries. Daisy, however, doesn't fancy herself much of an artist. When she meets the local photographer Jack Palmer at an exhibition, she ropes him into her plan and begins to see a new future for herself.
                ","Comedy, Romance, Drama",English,Alexander Jeffery,"Jency Griffin Hogan, Aaron Hogan, Emily Morrow","Alexander Jeffery, Paul T.O. Petersen, Paul Petersen, Jency Griffin Hogan",,"May 26, 2023",1h 35m,Good Deed Entertainment,"Hogan Productions, Eye Wander Productions",,,,,
56,https://www.rottentomatoes.com/m/marvels_the_avengers,Marvel's the Avengers,"
                    When Thor's evil brother, Loki (Tom Hiddleston), gains access to the unlimited power of the energy cube called the Tesseract, Nick Fury (Samuel L. Jackson), director of S.H.I.E.L.D., initiates a superhero recruitment effort to defeat the unprecedented threat to Earth. Joining Fury's ""dream team"" are Iron Man (Robert Downey Jr.), Captain America (Chris Evans), the Hulk (Mark Ruffalo), Thor (Chris Hemsworth), the Black Widow (Scarlett Johansson) and Hawkeye (Jeremy Renner).
                ","Action, Adventure, Fantasy, Sci-fi",English,Joss Whedon,Kevin Feige,Joss Whedon,"May 4, 2012 wide","Sep 25, 2012",2h 23m,Walt Disney,Marvel Studios,,PG-13 (Intense Sci-Fi Action/Violence|A Mild Drug Reference),Marvel Cinematic Universe,,
57,https://www.rottentomatoes.com/m/shazam_fury_of_the_gods,Shazam! Fury of the Gods,"
                    From New Line Cinema comes ""Shazam! Fury of the Gods,"" which continues the story of teenage Billy Batson who, upon reciting the magic word ""SHAZAM!,"" is transformed into his adult Super Hero alter ego, Shazam.
                ","Action, Adventure, Comedy, Fantasy",English,David F. Sandberg,Peter Safran,"Henry Gayden, Chris Morgan","Mar 17, 2023 wide","Apr 7, 2023",2h 10m,Warner Bros. Pictures,"New Line Cinema, Warner Bros., DC Entertainment",Digital 2.39:1,PG-13 (Sequences of Action|Language|Violence),DC Universe,$57.6M,"Dolby Digital, Dolby Atmos"
58,https://www.rottentomatoes.com/m/the_hole_in_the_fence,The Hole in the Fence,"
                    At a secluded exclusive summer camp in the Mexican countryside, under the watchful eyes of their adult guardians, boys from a prestigious private school receive physical, moral and religious training to turn them into tomorrow's elite. The discovery of a hole in the fence sets in motion a chain of disturbing events as the boys devolve into a Lord of the Flies-like mob mentality that creates and spreads hysteria in this profoundly disturbing coming-of-age drama that unravels like a horror movie while drawing on actual events.
                ","Drama, Mystery & thriller",Spanish,Joaquin del Paso,Fernanda De la Peza,"Joaquin del Paso, Lucy Pawlak","May 26, 2023 limited","May 26, 2023",1h 42m,Altered Innocence,,,,,,
59,https://www.rottentomatoes.com/m/operation_fortune_ruse_de_guerre,Operation Fortune: Ruse de guerre,"
                    In the film, super spy Orson Fortune (Jason Statham) must track down and stop the sale of a deadly new weapons technology wielded by billionaire arms broker Greg Simmonds (Hugh Grant). Reluctantly teamed with some of the world’s best operatives (Aubrey Plaza, Cary Elwes, Bugzy Malone), Fortune and his crew recruit Hollywood's biggest movie star Danny Francesco (Josh Hartnett) to help them on their globe-trotting undercover mission to save the world.
                ","Action, Comedy, Mystery & thriller",English,Guy Ritchie,"Ivan Atkinson, Bill Block, Steve Chasman, Guy Ritchie, Jason Statham","Guy Ritchie, Ivan Atkinson, Marn Davies","Mar 3, 2023 wide","Mar 21, 2023",1h 54m,Lionsgate,"The Searchers NV, Tencent Pictures, AZ Celtic Films, STX Films, Miramax, Toff Guy Films",,R (Language and Violence),,$6.4M,
