91,https://www.rottentomatoes.com/m/infinity_pool_2023,Infinity Pool,"
                    While staying at an isolated island resort, James (Alexander Skarsgård) and Em (Cleopatra Coleman) are enjoying a perfect vacation of pristine beaches, exceptional staff, and soaking up the sun. But guided by the seductive and mysterious Gabi (Mia Goth), they venture outside the resort grounds and find themselves in a culture filled with violence, hedonism, and untold horror. A tragic accident leaves them facing a zero tolerance policy for crime: either you'll be executed, or, if you're rich enough to afford it, you can watch yourself die instead.
                ","Horror, Mystery & thriller, Sci-fi",English,Brandon Cronenberg,"Andrew Cividino, Rob Cotterill, Jonathan Halperyn, Karen Harnisch, Anita Juka, Daniel Kresmery, Christina Piovesan, Noah Segal",Brandon Cronenberg,"Jan 27, 2023 wide","Feb 14, 2023",1h 57m,NEON,"Elevation Pictures, Celluloid Dreams, Film Forge., 4 Film, Hero Squared, Croatian Film Association",,R,,$5.1M,
92,https://www.rottentomatoes.com/m/land_of_gold,Land of Gold,"
                    Kiran Singh, a 1st generation Punjabi-American, has just accepted a last-minute trucking job to Boston which causes a blow-up argument with Preeti, his 37-week pregnant wife, who admits to feeling abandoned. En route to complete this ""one final job,"" Kiran discovers Elena,  a 10-year-old Mexican-American stowed away in his trailer. After debating the merits of turning her to the police, Kiran deduces she might be undocumented, and instead resolves to shepherd Elena to her uncle in Maine despite putting his own livelihood in jeopardy. As the pair ride across the changing American landscape, Kiran faces what it means to be a father and Elena learns how to trust again. They connect through family, dreams of the future, and a healthy debate over God’s existence, all while the ghosts of the past, racially charged encounters, and the threat of I.C.E. linger over their journey. 

                ",Drama,English,Nardeep Khurmi,"Keertana Sastry, Pallavi Sastry, Simon Taufique, Nardeep Khurmi",Nardeep Khurmi,"May 5, 2023 limited","May 15, 2023",1h 45m,Max,"Black Poppy Productions, Team Access Productions, Legacy Pictures (II)",,,,,
93,https://www.rottentomatoes.com/m/guardians_of_the_galaxy_vol_2,Guardians of the Galaxy Vol. 2,"
                    Peter Quill and his fellow Guardians are hired by a powerful alien race, the Sovereign, to protect their precious batteries from invaders. When it is discovered that Rocket has stolen the items they were sent to guard, the Sovereign dispatch their armada to search for vengeance. As the Guardians try to escape, the mystery of Peter's parentage is revealed.
                ","Sci-fi, Adventure, Action, Fantasy, Comedy",English,James Gunn,Kevin Feige,James Gunn,"May 5, 2017 wide","Aug 22, 2017",2h 15m,Walt Disney Pictures,"Marvel Studios, Walt Disney Pictures",Scope (2.35:1),PG-13 (Language|Brief Suggestive Content|Sequences of Sci-Fi Action|Violence),Marvel Cinematic Universe,$389.8M,"Dolby Atmos, Dolby Digital"
94,https://www.rottentomatoes.com/m/bullet_train_2022,Bullet Train,"
                    In Bullet Train, Brad Pitt stars as Ladybug, an unlucky assassin determined to do his job peacefully after one too many gigs gone off the rails. Fate, however, may have other plans, as Ladybug's latest mission puts him on a collision course with lethal adversaries from around the globe -- all with connected, yet conflicting, objectives -- on the world's fastest train. From the director of Deadpool 2, David Leitch, the end of the line is only the beginning in a wild, non-stop thrill ride through modern-day Japan.
                ","Action, Comedy",English,David Leitch,"Kelly McCormick, David Leitch, Antoine Fuqua",Zak Olkewicz,"Aug 5, 2022 wide","Dec 3, 2022",2h 6m,Columbia Pictures,"Sony Pictures Entertainment (SPE), 87North, Hill District Media, CTB Inc.",Scope (2.35:1),R (Pervasive Language|Brief Sexuality|Strong and Bloody Violence),,$103.1M,Dolby Atmos
95,https://www.rottentomatoes.com/m/roadkill_2022,Roadkill,"
                    Like a modern-day Highwayman, Connor Shelby spends his days on the isolated highways of rural Australia stealing from unsuspecting victims. He justifies his actions by saving his earnings in the hope of taking the love of his life, Lucy Miller, out of the harsh and unforgiving Australian outback. Across the country, in his 'quest from God', a serial killer moves from town-to-town executing those he believes to be 'sinful'. Hot on his trail are Detectives Albert and Ernest, driven and logical, the pair follow the trail of bodies in an attempt to find and stop the brutal killer. Their hunt brings them to the South Australian town of Renmark, Connor's current refuge. After two young men report being mugged on the highway, the detectives investigate and discover the two cases may be closer to one another than he first realized. After having his identity exposed, Connor's hunt for redemption, justice and most importantly, revenge, begins.
                ","Mystery & thriller, Action",English,Alexander Whitrow,"James Whitrow, Alexander Whitrow",Alexander Whitrow,,"May 23, 2023",1h 33m,Trinity Creative Partnership / Reel2Reel Films,Soul Stone Pictures,,,,,
96,https://www.rottentomatoes.com/m/shang_chi_and_the_legend_of_the_ten_rings,Shang-Chi and the Legend of the Ten Rings,"
                    Marvel Studios' ""Shang-Chi and The Legend of The Ten Rings"" stars Simu Liu as Shang-Chi, who must confront the past he thought he left behind when he is drawn into the web of the mysterious Ten Rings organization. The film also stars Tony Leung as Wenwu, Awkwafina as Shang-Chi's friend Katy and Michelle Yeoh as Jiang Nan, as well as Fala Chen, Meng'er Zhang, Florian Munteanu and Ronny Chieng.
                ","Action, Adventure, Fantasy",English,Destin Daniel Cretton,"Kevin Feige, Jonathan Schwartz","David Callaham, Destin Daniel Cretton, Andrew Lanham","Sep 3, 2021 wide","Nov 12, 2021",2h 13m,,"Walt Disney Pictures, Fox Studios Australia, Marvel Studios",Scope (2.35:1),PG-13 (Sequences of Violence & Action|Language),Marvel Cinematic Universe,$224.5M,"Dolby Atmos, Dolby Digital"
97,https://www.rottentomatoes.com/m/the_super_mario_bros_movie,The Super Mario Bros. Movie,"
                    With help from Princess Peach, Mario gets ready to square off against the all-powerful Bowser to stop his plans from conquering the world.
                ","Kids & family, Comedy, Adventure, Animation",English,"Aaron Horvath, Michael Jelenic","Christopher Meledandri, Shigeru Miyamoto",Matthew Fogel,"Apr 5, 2023 wide","May 16, 2023",1h 32m,Universal Pictures,"Illumination Entertainment, Universal Pictures, Nintendo",Digital 2.39:1,PG (Action and Mild Violence),,$549.1M,"Dolby Atmos, DTS, Dolby Digital"
98,https://www.rottentomatoes.com/m/air_2023,Air,"
                    From award-winning director Ben Affleck, AIR reveals the unbelievable game-changing partnership between a then-rookie Michael Jordan and Nike's fledgling basketball division which revolutionized the world of sports and contemporary culture with the Air Jordan brand. This moving story follows the career-defining gamble of an unconventional team with everything on the line, the uncompromising vision of a mother who knows the worth of her son’s immense talent, and the basketball phenom who would become the greatest of all time.
                ","Drama, Sports",English,Ben Affleck,"Ben Affleck, Matt Damon, David Ellison, Jesse Sisgold, Jon Weinbach, Madison Ainley, Jeff Robinov, Peter Guber, Jason Michael Berman",Alex Convery,"Apr 5, 2023 wide","May 12, 2023",1h 52m,Amazon Studios,"Artists Equity, Mandalay Pictures",Flat (1.85:1),R (Language),,$52.3M,Dolby Digital
99,https://www.rottentomatoes.com/m/cocaine_bear,Cocaine Bear,"
                    Inspired by the 1985 true story of a drug runner's plane crash, missing cocaine, and the black bear that ate it, this wild thriller finds an oddball group of cops, criminals, tourists and teens converging in a Georgia forest where a 500-pound apex predator has ingested a staggering amount of cocaine and gone on a coke-fueled rampage for more blow... and blood.
                ","Mystery & thriller, Comedy",English,Elizabeth Banks,"Phil Lord, Chris Miller, Elizabeth Banks, Max Handelman, Brian Duffield, Aditya Sood, Matt Reilly, Christine Sun",Jimmy Warden,"Feb 24, 2023 wide","Mar 21, 2023",1h 35m,Universal Pictures,"Universal Studios, Lord Miller, Universal 1440 Entertainment, Brownstone Productions",Digital 2.39:1,R (Drug Content|Bloody Violence and Gore|Language Throughout),,$64.4M,
100,https://www.rottentomatoes.com/m/the_son,The Son,"
                    A cautionary tale that follows a family as it struggles to reunite after falling apart. THE SON centers on Peter (Hugh Jackman), whose hectic life with his infant and new partner Beth (Vanessa Kirby) is upended when his ex-wife Kate (Laura Dern) appears at his door to discuss their son Nicholas (Zen McGrath), who is now a teenager. The young man has been missing school for months and is deeply troubled. Peter strives to take care of Nicholas as he would have wanted his own father (Anthony Hopkins) to have taken care of him while juggling his and Beth's new son, and at work an offer of a dream position in Washington. However, by reaching for the past to correct its mistakes, he loses sight of how to hold onto Nicholas in the present.
                ",Drama,English,Florian Zeller,"Iain Canning, Joanna Laurie, Karl Hartman, Emile Sherman, Christophe Spadone, Florian Zeller","Florian Zeller, Christopher Hampton","Nov 25, 2022 limited","Mar 28, 2023",2h 4m,Sony Pictures Classics,"Neddy Dean Productions, Film4, See-Saw Films, Embankment Films, Orange Studio, Ciné@, Ingenious Media",Digital 2.39:1,PG-13 (Suicide|Strong Language|Mature Thematic Content),,$449.6K,Dolby Digital
101,https://www.rottentomatoes.com/m/ant_man_and_the_wasp_quantumania,Ant-Man and The Wasp: Quantumania,"
                    Super-Hero partners Scott Lang (Paul Rudd) and Hope van Dyne (Evangeline Lilly) return to continue their adventures as Ant-Man and the Wasp. Together, with Hope's parents Janet van Dyne (Michelle Pfeiffer) and Hank Pym (Michael Douglas), and Scott's daughter Cassie Lang (Kathryn Newton), the family finds themselves exploring the Quantum Realm, interacting with strange new creatures and embarking on an adventure that will push them beyond the limits of what they thought possible.
                ","Action, Adventure, Fantasy, Comedy",English,Peyton Reed,"Kevin Feige, Stephen Broussard",Jeff Loveness,"Feb 17, 2023 wide","Apr 18, 2023",2h 4m,Walt Disney Pictures,"Walt Disney Pictures, Marvel Studios, The South Australian Film Corporation, Québec Production Services Tax Credit",,PG-13 (Violence/Action|Language),Marvel Cinematic Universe,$214.4M,Dolby Atmos
102,https://www.rottentomatoes.com/m/fast_and_the_furious_tokyo_drift,The Fast and the Furious: Tokyo Drift,"
                    Sean Boswell (Lucas Black) always feels like an outsider, but he defines himself through his victories as a street racer. His hobby makes him unpopular with the authorities, so he goes to live with his father in Japan. Once there and even more alienated, he learns about an exciting, but dangerous, new style of the sport. The stakes are high when Sean takes on the local champion and falls for the man's girlfriend.
                ",Action,English,Justin Lin,Neal H. Moritz,"Alfredo Botello, Chris Morgan, Kario Salem","Jun 16, 2006 wide","Sep 26, 2006",1h 44m,Universal Pictures,"Universal Pictures, Original Film",Scope (2.35:1),PG-13 (Language|Involving Teens|Reckless and Illegal Behavior|Sexual Content|Violence),The Fast and the Furious,$62.5M,"SDDS, DTS, Dolby SRD"
103,https://www.rottentomatoes.com/m/dungeons_and_dragons_honor_among_thieves,Dungeons & Dragons: Honor Among Thieves,"
                    A charming thief and a band of unlikely adventurers undertake an epic heist to retrieve a lost relic, but things go dangerously awry when they run afoul of the wrong people. Dungeons & Dragons: Honor Among Thieves brings the rich world and playful spirit of the legendary roleplaying game to the big screen in a hilarious and action-packed adventure.
                ","Fantasy, Adventure, Action, Comedy",English,"Jonathan M. Goldstein, John Francis Daley","Jeremy Latcham, Brian Goldner, Nick Meyer","Jonathan M. Goldstein, John Francis Daley, Michael Gilio, Chris McKay","Mar 31, 2023 wide","May 2, 2023",2h 14m,Paramount Pictures,"Allspark Pictures, Hasbro Studios",Digital 2.39:1,PG-13 (Some Language|Fantasy Action/Violence),,$92.9M,"Dolby Digital, Dolby Atmos"
104,https://www.rottentomatoes.com/m/65,65,"
                    After a catastrophic crash on an unknown planet, pilot Mills (Adam Driver) quickly discovers he’s actually stranded on Earth... 65 million years ago. Now, with only one chance at rescue, Mills and the only other survivor, Koa (Ariana Greenblatt), must make their way across an unknown terrain riddled with dangerous prehistoric creatures in an epic fight to survive.
                ","Sci-fi, Adventure, Action, Mystery & thriller",English,"Scott Beck, Bryan Woods","Sam Raimi, Deborah Liebling, Zainab Azizi, Scott Beck, Bryan Woods","Scott Beck, Bryan Woods","Mar 10, 2023 wide","Apr 7, 2023",1h 33m,Columbia Pictures,"Raimi Productions, Beck Woods, Columbia Pictures, BRON Creative, Sony Pictures Entertainment (SPE)",Digital 2.39:1,PG-13 (Intense Sci-Fi Action|Brief Bloody Images|Peril),,$31.5M,Dolby Digital
105,https://www.rottentomatoes.com/m/fast_five,Fast Five,"
                    Ever since ex-cop Brian O'Conner (Paul Walker) and Mia Torretto (Jordana Brewster) broke her brother Dom (Vin Diesel) out of custody, they've traveled border to border to evade authorities. In Rio de Janeiro, they must do one final job before they can gain their freedom for good. Assembling their elite team of car racers, Brian and Dom know they must confront the corrupt businessman who wants them dead, before the federal agent (Dwayne Johnson) on their trail finds them.
                ",Action,English,Justin Lin,"Neal H. Moritz, Vin Diesel, Michael Fottrell",Chris Morgan,"Apr 29, 2011 wide","Oct 4, 2011",2h 10m,Universal Pictures,"Original Film, One Race Productions",,PG-13 (Intense Sequences of Violence|Intense Sequences of Action|Language|Sexual Content),The Fast and the Furious,$209.8M,"SDDS, Dolby SRD, DTS"
106,https://www.rottentomatoes.com/m/synchronic,Synchronic,"
                    When New Orleans paramedics and longtime best friends Steve and Dennis are called to a series of bizarre and gruesome accidents, they chalk it up to a mysterious new drug found at the scene. But after Dennis' oldest daughter disappears, Steve stumbles upon a terrifying truth about the supposed psychedelic that will challenge everything he knows about reality -- and the flow of time itself.
                ","Sci-fi, Mystery & thriller",English,"Justin Benson, Aaron Moorhead","Justin Benson, Aaron Moorhead, David Lawson Jr., Michael Mendelsohn",Justin Benson,"Oct 23, 2020 limited","Jan 26, 2021",1h 40m,Well Go USA Entertainment,"Rustic Films, Patriot Pictures, Love & Death Productions, Pfaff & Pfaff Productions, XYZ Films",Scope (2.35:1),R (Language Throughout|Drug Content|Some Violent/Bloody Images),,$636.7K,
107,https://www.rottentomatoes.com/m/a_thousand_and_one,A Thousand and One,"
                    A THOUSAND AND ONE follows unapologetic and free-spirited Inez (Teyana Taylor), who kidnaps six-year-old Terry from the foster care system. Holding onto their secret and each other, mother and son set out to reclaim their sense of home, identity, and stability, in a rapidly changing New York City.
                ",Drama,English,A.V. Rockwell,"Eddie Vaisman, Julia Lebedev, Lena Waithe, Rishi Rajani, Brad Weston",A.V. Rockwell,"Mar 31, 2023 wide","Apr 18, 2023",1h 57m,Focus Features,"Sight Unseen Pictures, Makeready, Hillman Grad",,R (Language),,$3.4M,
108,https://www.rottentomatoes.com/m/pearl_2022,Pearl,"
                    Filmmaker Ti West returns with another chapter from the twisted world of X, in this astonishing follow-up to the year's most acclaimed horror film. Trapped on her family's isolated farm, Pearl must tend to her ailing father under the bitter and overbearing watch of her devout mother. Lusting for a glamorous life like she's seen in the movies, Pearl finds her ambitions, temptations, and repressions all colliding in this stunning, technicolor-inspired origin story of X's iconic villain.
                ","Horror, Mystery & thriller, Comedy",English,Ti West,"Jacob Jaffke, Harrison Kreiss, Kevin Turen, Ti West","Ti West, Mia Goth","Sep 16, 2022 wide","Oct 25, 2022",1h 42m,A24,"BRON Creative, Universal Studios Inc., Little Lamb, A24",Scope (2.35:1),R,,$8.2M,Dolby Atmos
109,https://www.rottentomatoes.com/m/to_catch_a_killer_2023,To Catch a Killer,"
                    A modern-day Clarice Starling, Eleanor (Shailene Woodley) is a young police investigator wrestling with the demons of her past when she is recruited by the FBI's chief investigator (Ben Mendelsohn) to help profile and track the work of a disturbed individual. As the police and FBI launch a nationwide manhunt, they are thwarted at every turn by the individual’s unprecedented behavior. Given her tortured psyche, Eleanor may be the only person who can understand the mind of their assailant and bring him to justice.
                ","Action, Crime, Drama, Mystery & thriller",English,Damián David Szifron,"Aaron Ryder, Stuart Manashil, Damián David Szifron, Shailene Woodley","Damián David Szifron, Jonathan Wakeham","Apr 21, 2023 limited","May 16, 2023",1h 59m,Vertical,"FilmNation Entertainment, RainMaker Films",,R (Strong Language|Strong Violent Content),,,
110,https://www.rottentomatoes.com/m/f9,F9 The Fast Saga,"
                    Vin Diesel's Dom Toretto is leading a quiet life off the grid with Letty and his son, little Brian, but they know that danger always lurks just over their peaceful horizon. This time, that threat will force Dom to confront the sins of his past if he's going to save those he loves most. His crew joins together to stop a world-shattering plot led by the most skilled assassin and high-performance driver they've ever encountered: a man who also happens to be Dom's forsaken brother, Jakob (John Cena, the upcoming The Suicide Squad).
                ","Action, Adventure, Crime",English,Justin Lin,"Neal H. Moritz, Vin Diesel, Justin Lin, Jeff Kirschenbaum, Joe Roth, Clayton Townsend, Samantha Vincent","Daniel Casey, Justin Lin","Jun 25, 2021 wide","Jul 30, 2021",2h 25m,Universal Pictures,"Perfect Storm Entertainment, Universal Pictures, One Race Films, Original Film, Roth/Kirschenbaum Films",Scope (2.35:1),PG-13 (Language|Action|Sequences of Violence),The Fast and the Furious,$173.0M,Dolby Atmos
111,https://www.rottentomatoes.com/m/fast_and_furious,Fast & Furious,"
                    When a crime brings them back to the mean streets of Los Angeles, fugitive ex-convict Dom Toretto (Vin Diesel) and agent Brian O'Conner (Paul Walker) reignite their high-octane feud. However, when a common enemy rears his head, Dom and Brian must learn how to work together and trust one another in order to defeat him.
                ","Action, Mystery & thriller",English,Justin Lin,"Neal H. Moritz, Vin Diesel, Michael Fottrell",Chris Morgan,"Apr 3, 2009 wide","Jul 28, 2009",1h 47m,Universal Pictures,"Original Film, One Race Productions",,PG-13 (Intense Sequences of Action|Drug References|Intense Sequences of Violence|Language|Some Sexual Content),The Fast and the Furious,$155.0M,
112,https://www.rottentomatoes.com/m/the_popes_exorcist,The Pope's Exorcist,"
                    Inspired by the actual files of Father Gabriele Amorth, Chief Exorcist of the Vatican (Academy Award®-winner Russell Crowe), The Pope's Exorcist follows Amorth as he investigates a young boy's terrifying possession and ends up uncovering a centuries-old conspiracy the Vatican has desperately tried to keep hidden.
                ","Horror, Mystery & thriller",English,Julius Avery,"Doug Belgrad, Michael Patrick Kaczmarek, Jeff Katz","Michael Petroni, Evan Spiliotopoulos, R. Dean McCreary, Chester Hastings","Apr 14, 2023 wide","May 2, 2023",1h 43m,"Sony Pictures Entertainment, Screen Gems","Jesus & Mary, Ad hoc studios, Screen Gems, Loyola Productions, 2.0 Entertainment, Intimacy on Set",,R (Sexual References|Language|Some Nudity|Violent Content),,$19.8M,
113,https://www.rottentomatoes.com/m/polite_society,Polite Society,"
                    A merry mash-up of sisterly affection, parental disappointment and bold action, POLITE SOCIETY follows martial artist-in-training Ria Khan who believes she must save her older sister Lena from her impending marriage. After enlisting the help of her friends, Ria attempts to pull off the most ambitious of all wedding heists in the name of independence and sisterhood. 
                ","Action, Comedy",English,Nida Manzoor,"Tim Bevan, Eric Fellner, Olivier Kaempfer, John Pocock",Nida Manzoor,"Apr 28, 2023 limited","May 16, 2023",1h 43m,Focus Features,Working Title Films,Digital 2.39:1,PG-13 (Strong Language|Some Partial Nudity|Sexual Material|Violence),,$1.5M,
114,https://www.rottentomatoes.com/m/huesera_the_bone_woman,Huesera: The Bone Woman,"
                    Valeria's joy at becoming a first-time mother is quickly taken away when she's cursed by a sinister entity. As danger closes in, she's forced deeper into a chilling world of dark magic that threatens to consume her.
                ","Horror, Mystery & thriller",Spanish,Michelle Garza Cervera,"Paulina Villavicencio, Edher Campos","Michelle Garza Cervera, Abia Castillo","Feb 10, 2023 limited","Feb 16, 2023",1h 33m,XYZ Films,Machete Producciones,,,,,
115,https://www.rottentomatoes.com/m/the_banshees_of_inisherin,The Banshees of Inisherin,"
                    Set on a remote island off the west coast of Ireland, THE BANSHEES OF INISHERIN follows lifelong friends Pádraic and Colm, who find themselves at an impasse when Colm unexpectedly puts an end to their friendship. A stunned Pádraic, aided by his sister Siobhán and troubled young islander Dominic, endeavours to repair the relationship, refusing to take no for an answer. But Pádraic's repeated efforts only strengthen his former friend’s resolve and when Colm delivers a desperate ultimatum, events swiftly escalate, with shocking consequences.
                ",Comedy,English,Martin McDonagh,"Graham Broadbent, Peter Czernin, Martin McDonagh",Martin McDonagh,"Nov 4, 2022 wide","Dec 13, 2022",1h 49m,Searchlight Pictures,Blueprint Pictures,Digital 2.39:1,R (Language Throughout|Brief Graphic Nudity|Some Violent Content),,$10.6M,Dolby Digital
116,https://www.rottentomatoes.com/m/guardians_of_the_galaxy,Guardians of the Galaxy,"
                    Brash space adventurer Peter Quill (Chris Pratt) finds himself the quarry of relentless bounty hunters after he steals an orb coveted by Ronan, a powerful villain. To evade Ronan, Quill is forced into an uneasy truce with four disparate misfits: gun-toting Rocket Raccoon, treelike-humanoid Groot, enigmatic Gamora, and vengeance-driven Drax the Destroyer. But when he discovers the orb's true power and the cosmic threat it poses, Quill must rally his ragtag group to save the universe.
                ","Sci-fi, Adventure, Action, Fantasy, Comedy",English,James Gunn,Kevin Feige,"James Gunn, Nicole Perlman","Aug 1, 2014 wide","Dec 9, 2014",2h 1m,Walt Disney Pictures,"Marvel Studios, Moving Picture Company, Marvel Enterprises",,PG-13 (Some Language|Intense Sci-Fi Action/Violence),Marvel Cinematic Universe,$333.7M,"Dolby Atmos, Dolby Digital"
117,https://www.rottentomatoes.com/m/puss_in_boots_the_last_wish,Puss in Boots: The Last Wish,"
                    This fall, everyone's favorite leche-loving, swashbuckling, fear-defying feline returns. For the first time in more than a decade, DreamWorks Animation presents a new adventure in the Shrek universe as daring outlaw Puss in Boots discovers that his passion for peril and disregard for safety have taken their toll. Puss has burned through eight of his nine lives, though he lost count along the way. Getting those lives back will send Puss in Boots on his grandest quest yet. Academy Award® nominee Antonio Banderas returns as the voice of the notorious PiB as he embarks on an epic journey into the Black Forest to find the mythical Wishing Star and restore his lost lives. But with only one life left, Puss will have to humble himself and ask for help from his former partner and nemesis: the captivating Kitty Soft Paws (Oscar® nominee Salma Hayek). In their quest, Puss and Kitty will be aided--against their better judgment--by a ratty, chatty, relentlessly cheerful mutt, Perro (Harvey Guillén, What We Do in the Shadows). Together, our trio of heroes will have to stay one step ahead of Goldilocks (Oscar® nominee Florence Pugh, Black Widow) and the Three Bears Crime Family, ""Big"" Jack Horner (Emmy winner John Mulaney, Big Mouth) and terrifying bounty hunter, The Big Bad Wolf (Wagner Moura, Narcos).
                ","Kids & family, Comedy, Adventure, Animation",English,Joel Crawford,Mark Swift,"Paul Fisher, Tommy Swerdlow","Dec 21, 2022 wide","Jan 6, 2023",1h 42m,Universal Pictures,DreamWorks Animation,Digital 2.39:1,PG (Rude Humor/Language|Action/Violence|Some Scary Moments),,$185.5M,"Dolby Digital, Dolby Atmos"
